{
  "$schema": "./palette.schema.json",
  "name": "Penamiller",
  "author": "parraletz",
  "background": "#141413",
  "background_source": "sampled screenshot interior (20,20,19); ANSI and extras use labeled hex values",
  "foreground": "#FAF9F5",
  "ansi": [
    "#262624",
    "#D9483E",
    "#6AA84F",
    "#E0A82E",
    "#4A86D6",
    "#C05BC4",
    "#3EA6B8",
    "#C9C6BB",
    "#5E5D59",
    "#FF7A6B",
    "#9BD35F",
    "#FFD36B",
    "#7FB0F0",
    "#E48AE9",
    "#72CDDD",
    "#FAF9F5"
  ],
  "extras": {
    "orange": "#D97757",
    "orange_bright": "#F0956F",
    "pink": "#E86F9A",
    "teal": "#3FB8A4",
    "lavender": "#9D8CF0",
    "lime": "#B6D94C",
    "sky": "#6A9BCC",
    "sand": "#E8E6DC"
  }
}
